title,count,comment_text,vote,reply,date
Música tema - KIC 2022 | Honor of Kings Brasil,88,"pfv invista nos brasileiros, n seja igual a concorrência q so desiste",97,10 replies,1 year ago
Música tema - KIC 2022 | Honor of Kings Brasil,88,"Adorei a música 
 meu Neto faz faculdade designer de jogos e entretenimento digital",10,0,1 year ago
Música tema - KIC 2022 | Honor of Kings Brasil,88,Essa música ficou imensamente foda! Slc,40,1 reply,1 year ago
Música tema - KIC 2022 | Honor of Kings Brasil,88,A animação está maravilhosa!!,25,1 reply,1 year ago
Música tema - KIC 2022 | Honor of Kings Brasil,88,Que Coisa Boa Tava esperando Pelo dia da música do Mundial,12,0,1 year ago
Música tema - KIC 2022 | Honor of Kings Brasil,88,"Marina 
a bênção do movimento vira ao meu encontro em nome de Jesus amém",6,0,1 year ago
Música tema - KIC 2022 | Honor of Kings Brasil,88,AI QUE LINDOOO MANOOOO,11,0,1 year ago
Música tema - KIC 2022 | Honor of Kings Brasil,88,"bota essa música no lançamento global, na tela de login ou no lobby do jogo, ficaria mt foda",53,6 replies,1 year ago
Música tema - KIC 2022 | Honor of Kings Brasil,88,Meu neto faz designer de jogos e entretenimento digital faculdade se forma ano que vem música linda jogo lindo demais,4,0,1 year ago
Música tema - KIC 2022 | Honor of Kings Brasil,88,"Amanhã lança o jogo, o hype ta insano. Bora pra cima Tencent. Rumo ao topo do Brasil.",5,0,1 year ago
Música tema - KIC 2022 | Honor of Kings Brasil,88,MANO incrível,5,0,1 year ago
Música tema - KIC 2022 | Honor of Kings Brasil,88,Muito bravo,5,0,1 year ago
Música tema - KIC 2022 | Honor of Kings Brasil,88,Lindo demais,5,0,1 year ago
Música tema - KIC 2022 | Honor of Kings Brasil,88,Simplesmente incrível,4,0,1 year ago
Música tema - KIC 2022 | Honor of Kings Brasil,88,"Investe mais em divulgação, que eu acredito que esse jogo só cresce mais e mais",4,0,1 year ago
Música tema - KIC 2022 | Honor of Kings Brasil,88,adorei a música,4,0,1 year ago
Música tema - KIC 2022 | Honor of Kings Brasil,88,"VALEEEEEU!!! 
🇧🇷",4,0,1 year ago
Música tema - KIC 2022 | Honor of Kings Brasil,88,Essa música ficou incrível!!!,3,0,1 year ago
Música tema - KIC 2022 | Honor of Kings Brasil,88,mt bom,5,0,1 year ago
Música tema - KIC 2022 | Honor of Kings Brasil,88,Que daora mano,3,0,1 year ago
Música tema - KIC 2022 | Honor of Kings Brasil,88,BRABO !,2,0,1 year ago
Música tema - KIC 2022 | Honor of Kings Brasil,88,Ficou massa demais,4,1 reply,1 year ago
Música tema - KIC 2022 | Honor of Kings Brasil,88,Deveria colocar as outra musicas temas dos anteriores kics que teve.,0,0,3 months ago
Música tema - KIC 2022 | Honor of Kings Brasil,88,Música 10/10,2,0,1 year ago
Música tema - KIC 2022 | Honor of Kings Brasil,88,,3,0,1 year ago
Música tema - KIC 2022 | Honor of Kings Brasil,88,Coloque a música na tela inicial no lançamento,1,0,1 year ago
Música tema - KIC 2022 | Honor of Kings Brasil,88,Para cuando los servidores para  CENTRO  AMÉRICA,2,0,1 year ago (edited)
Música tema - KIC 2022 | Honor of Kings Brasil,88,"Top muito bom 
0:13",0,0,6 months ago
Música tema - KIC 2022 | Honor of Kings Brasil,88,KIC 2022 CASTERS SBT ANCHOR CELSO PORTIOLLI/CARLOS NASCIMENTO/DENYA ROBINETTE/DARIUS ZIMENES/EDDIE SANDY,1,0,3 days ago (edited)
Música tema - KIC 2022 | Honor of Kings Brasil,88,i like this animation !,2,0,1 year ago
Música tema - KIC 2022 | Honor of Kings Brasil,88,Animação fodaaa,0,0,5 months ago
Música tema - KIC 2022 | Honor of Kings Brasil,88,"KIC 2022 CASTERS CANAL 13 ANCHOR
SABANA TARTOROS/NIMA VENTO
DON FRANCISCO/GEBALI JIMENEZ
PANCHO CJ SAAVEDRA/KARL BACELINA",1,0,10 hours ago
Música tema - KIC 2022 | Honor of Kings Brasil,88,Ual,2,0,10 months ago
Música tema - KIC 2022 | Honor of Kings Brasil,88,Tá faltando legendar né adm,2,0,1 year ago
Música tema - KIC 2022 | Honor of Kings Brasil,88,Para cuando va a salir para el resto de latinoamerica?,0,0,6 months ago
Música tema - KIC 2022 | Honor of Kings Brasil,88,Caraca muito lindo top de mais,2,0,10 months ago
Música tema - KIC 2022 | Honor of Kings Brasil,88,"Eu quero a música tema do lançamento oficial
 Chega de beta",7,0,1 year ago
Música tema - KIC 2022 | Honor of Kings Brasil,88,Uruuuuuu,0,0,8 months ago
Música tema - KIC 2022 | Honor of Kings Brasil,88,,1,0,1 year ago
Música tema - KIC 2022 | Honor of Kings Brasil,88,"KIC 2022 CASTERS POGO ANCHOR
HAJIMA BHANA/CYRUS SAHUKAR
DIANA KENNEDY/JAMIETA THANOS
BOGETRA NALA/UJITAHA BANOS",1,0,10 hours ago
Música tema - KIC 2022 | Honor of Kings Brasil,88,"🇧🇷
️",1,0,1 year ago
Música tema - KIC 2022 | Honor of Kings Brasil,88,Por que vocês não contratam o Imagine dragons e pedem pra eles fazerem uma música tema chamada soldado ? Ou Berserks?,0,0,5 months ago
Música tema - KIC 2022 | Honor of Kings Brasil,88,Mano isso vai bombar demais no Brasil já tenho uma tropa esperando o lançamento,1,0,1 year ago
Música tema - KIC 2022 | Honor of Kings Brasil,88,"I'm miss you honor of 
 king Brazil server inglish United States America",0,0,1 year ago
Música tema - KIC 2022 | Honor of Kings Brasil,88,"So falta mudar o nome dos heróis, pois no ocidente são intragáveis",1,0,1 year ago
Música tema - KIC 2022 | Honor of Kings Brasil,88,kelass,1,0,1 year ago
Música tema - KIC 2022 | Honor of Kings Brasil,88,O beta acaba quando,1,1 reply,1 year ago
Música tema - KIC 2022 | Honor of Kings Brasil,88,"Bom de começar a bancar alguns criadores de conteúdo antes do Camp, pq aqui no Brasil q teve beta fechado, pelo visto, vai miar
Oh as visualizações do tema oficial do torneio véi, estão colocando muita espectativa numa região q pelo visto, tá cagando pro competitivo, a riot gastou horrores com criadores de conteúdo e o competitivo flopou, quem dirá assim sem investimento nenhum, a música tá fd e tenho ctz q os asiáticos estão pirando com tudo isso, mas como no Brasil se tem uma expectativa maior de ""potência"" econômica, já q criança no Brasil gasta muito com mobile, deveriam melhorar marketing antes do torneio, do jeito q tá, se passar 3k como no torneio q rolou, vai ser muito.",2,0,1 year ago
Música tema - KIC 2022 | Honor of Kings Brasil,88,"Agora todo mundo do Brasil é negro né, vou falar nada",1,0,3 weeks ago (edited)
Música tema - KIC 2022 | Honor of Kings Brasil,88,Faltou algo.,0,0,5 months ago
Música tema - KIC 2022 | Honor of Kings Brasil,88,Quando começa o campeonato?,2,5 replies,1 year ago
Música tema - KIC 2022 | Honor of Kings Brasil,88,"When available play store honor of 
 king Brazil server",1,0,1 year ago
Música tema - KIC 2022 | Honor of Kings Brasil,88,,0,0,5 months ago
Música tema - KIC 2022 | Honor of Kings Brasil,88,ai vc me fala que isso dai n é copiar a riot kkkkkkkkkk o fd é que ela até já desistiu de processar esses cara mn... porque É TODA HORA VEEEEEY KKKKKKKK,3,2 replies,1 year ago
Música tema - KIC 2022 | Honor of Kings Brasil,88,Credo,2,0,1 year ago
Música tema - KIC 2022 | Honor of Kings Brasil,88,垃圾游戏，凉了吧,0,0,7 months ago
Música tema - KIC 2022 | Honor of Kings Brasil,88,"que sacanagem, porque o Brasil só é representado por esse tipo de gente 
literalmente em todos os jogos ou o Brasil é representado pela Amazônia ou por esse tipo de gente cujo não irei citar detalhes",3,0,11 months ago
"E aí, Brasil｜Anúncio de pré-registro｜Honor of Kings",609,"Olha a atenção do Honor of Kings fazendo um vídeo exclusivo para o Brasil! E o vídeo ficou LINDO, não vejo a hora de lançar 
O único problema que está dando erro na play store, fica a mensagem que o jogo não esta disponível  para esse país então não estou conseguindo fazer o pré-registro
Emocionei-me com esse vídeo. Que cuidado pra retratar partes da nossa cultura nesse vídeo, respeito vindo do povo chinês para conosco. Hype reelevado pra o lancamento do jogo. Vem logo, Honor Of Kings!
 @mycaeldasilvadejesus3580 
 Fala Mycael, sua conta da Play Store está registrada no Brasil? Chama a gente no discord que vamos tentar ajudar!
Também estamos ansiosos 
 @honorofkingsbrasil 
 eu tinha uma conta já, eu não vou perder não né?(criei e upei ela enquanto eu conseguia jogar o acesso antecipado.)
BOTA LINDO NISSO AMOS VER SE AGORA TA RODANDO EM CELULARES FRACO NÉH SE NAO VAI SER FLOP TOTAL
 @INSANOSfpsOficial 
 cê jogou o acesso antecipado? O jogo tá lindo. Rodando mto bem no meu motog20
 @Ojosevinicius 
 Óbvio que tu vai perder, tu ganhou 10k de tickets pow kkkkkkkkk
 @Rrafael69 
 e daí, é como uma recompensa de quem joga acesso antecipado, igual eu tenho no cód uma arma de early acesa.
 @Ojosevinicius 
 Mas a empresa já cansou de falar que as contas vão ser resetadas",637,0,1 year ago
"E aí, Brasil｜Anúncio de pré-registro｜Honor of Kings",609,"Um jogo de origem chinesa com uma carga cultural e histórica pesada desse país, respeitando muito a cultura e povo brasileiro nesse vídeo S-E-N-S-A-C-I-O-N-A-L ! Ganhei meu dia vendo esse vídeo! Correu uma lágrima sorrateira do meu olho, cara ! A staff do Honor Of Kings tem meu respeito!
Agradecemos demais, Fernando! E é só o começo, vamos ainda mais longe juntos com a comunidade br 
 @honorofkingsbrasil 
 Pode me ajudar, quando eu abaixava e entra no jogo ele sai sozinho o que eu devo fazer ?
 @diogoteles7307 
 Fala Diogo, vários bugs vão ser corrigidos no lançamento. Caso encontre algum problema após o lançamento, pode entrar em contato com a gente pelo nosso servidor do discord ou no nosso instagram/facebook ou twitter.
 @honorofkingsbrasil 
 Ok, obrigado estou ansioso para jogar o jogo
 @honorofkingsbrasil 
 tomara que seja esse mês ainda tô torcendo pra isso
Amo demais esse jogo cara veio pra ficar no Br...bem vindos .
Respeito?
 @honorofkingsbrasil 
 Tmj !
 @haumsegundoatras4102 
 Desrespeito ? Só falta tu falar que teve isso.",321,0,1 year ago (edited)
"E aí, Brasil｜Anúncio de pré-registro｜Honor of Kings",609,"O Brasil sempre foi deixado de lado pela maioria dos jogos, aquele sentimento de que somos só mais um  e que não temos tanta importância. O jogo nem lançou oficialmente, mas já é tão PERFEITO ver o carinho que o HoK está tendo com o Brasil. Primeiro canto a ter o pre-registro, um vídeo totalmente MARAVILHOSO feito com carinho só para o Brasil é de aquecer o coração. Espero toda a equipe do HoK saiba que o Brasil se derreteu com esse vídeo! PERFEITO! Só continuar nesse caminho que com certeza se torna o moba mais jogado e AMADO do Brasil! Meu amor o jogo já tem.
Estamos fechados com o Brasil 🫶 hahaha
 @honorofkingsbrasil 
 Việt Nam ra chưa z 🇸🇷🇸🇷🇸🇷🇸🇷",148,0,1 year ago
"E aí, Brasil｜Anúncio de pré-registro｜Honor of Kings",609,"Por favor que o jogo dê certo!! Invistam bastante em anúncios pra competir com Mobile Legends
Esse jogo tem que dar certo ele é Perfeito 
️
️
️",25,0,1 year ago
"E aí, Brasil｜Anúncio de pré-registro｜Honor of Kings",609,"crl a moral que eles estão dando pra gente, espero q o jogo esteja cheio de recompensas maneiras e que esteja maravilhoso.
Estamos trabalhando muito para que seja o melhor game possível! 
​
 @honorofkingsbrasil 
 e será.",84,0,1 year ago
"E aí, Brasil｜Anúncio de pré-registro｜Honor of Kings",609,"a moral q os cr tão dando pros br 🇧🇷
️
HoK 
 Brasil
Kkk bela moral de favela
 @Happ1n3ss 
 não que sabia mas você entendeu o que eu quis dizer?
 @haumsegundoatras4102 
 Já viu o Brasil ter mais prédios de ricos doq favela?
​
 @haumsegundoatras4102 
 vsfdkkkkkk",187,0,1 year ago
"E aí, Brasil｜Anúncio de pré-registro｜Honor of Kings",609,"Somos o Primeiro País a entrar em Pré Registro!
Olha esse Video Maravilhoso
Ying na FAVELA do Rio de Janeiro!!
Tem coisa mais linda do que isso??? 
️
️
️
Vou divulgar o Honor of Kings com todas as minhas forças os cara tão dando muita moral pra nós 
quem dera se meus amigos jogassem mobas mais vou jogar quando meu cell chegar
 @HARTEPLQ. 
 tbm vou 
Agradecemos pelo apoio pessoal 
​
 @HARTEPLQ. 
 Chega junto no nosso discord, lá você consegue fazer novos amigos e encontrar pessoas para jogar com você 
So falto a a AK na mão da Ying....mais isso a gente releva ficou lindo
 @HARTEPLQ. 
 Se preocupa não mano, eu jogo contigo
Roubaram a lança dela :(",83,0,1 year ago (edited)
"E aí, Brasil｜Anúncio de pré-registro｜Honor of Kings",609,"Maluco! Eu tava desanimado com a demora do lançamento, mas depois de ver o cuidado e o capricho que o HoK ta tendo com os brasileiros o Hype até voltou!",21,0,1 year ago
"E aí, Brasil｜Anúncio de pré-registro｜Honor of Kings",609,"Só por causa dessa cinematic o jogo já me ganhou, pensaram na comunidade BR e é raro acontecer , muito obrigado por pensar na em nós! Vou jogar muito Honor of Kings em 2023
️
️
️",13,0,1 year ago
"E aí, Brasil｜Anúncio de pré-registro｜Honor of Kings",609,Honor of kings realmente viu a cultura do país além do futebol,5,0,7 months ago
"E aí, Brasil｜Anúncio de pré-registro｜Honor of Kings",609,"Cara que épico essa homenagem ao Brasil HOK !! Joguei no beta e cara, o jogo tá muito lindo, quero muito jogar com essa versão official !! Já fiz o pré-registro e vo tá acompanhado essa obra de arte que promete !! Tmj Honor of Kings !! E eu quero minha skin que foi prometida em !!!",10,0,1 year ago
"E aí, Brasil｜Anúncio de pré-registro｜Honor of Kings",609,"NAMORAL????? vcs fizeram isso mesmo?....Apaixonei 
E ainda vamos fazer muito mais, é só o começo!",27,0,1 year ago
"E aí, Brasil｜Anúncio de pré-registro｜Honor of Kings",609,"E parabéns por chamar influenciadores que a gente já conhece Mano esse jogo vai ser o melhor desse ano 
Estamos trabalhando muito pra isso! Valeeu LC!",18,0,1 year ago
"E aí, Brasil｜Anúncio de pré-registro｜Honor of Kings",609,FIcou bonito mesmo e a dublagem do honor of kings está muito boa no geral!,16,0,1 year ago
"E aí, Brasil｜Anúncio de pré-registro｜Honor of Kings",609,"Estão fazendo o que o Wild Rift não prestou pra fazer, apenas dá atenção pra nossa comunidade! Era só isso... 
Parabéns pra Staff do HOK, ganharam meu voto de confiança!! 
️
Vamos fazer por merecer esse voto! 
old
Kkkkkk não do um mês pra cair no esquecimento
 @willbueno4719 
 n
 @willbueno4719 
 Cai nada.... joguei o beta e foi muito melhor que outros mobas.
 @willbueno4719 
 é porque tu não jogou o beta, game bem otimizado, bem dinâmico e legal, fácil de aprender, além de investirem grande em marketing, antes de lançar
 @willbueno4719 
 Pode cair até no dia do lançamento, mas mesmo assim já fez o que o wild rift não fez em vários anos de ""vida"".
 @alexia5564 
 continua sendo feio com gráfico porco se pra ser free fire dos mobas conseguiu essa bomba campeões idênticos  do lol  nem pra mudar algo pelo menos mobile legends muda algo na hora de copiar se quer um Wr de baixo orçamento está ae perfeito pra vcs 
️
 @willbueno4719 
 mds kkkkkk o jogo n tem nada aver com o lol, além dos bonecos serem diferentes, mbl sim copiou alguns bonecos do lol e outra se quiser jogar um jogo falido aonde a própria Impresa abandonou o jg, q não tem uma rankeada decente e n tem nem público, bom fica no wr.. 
 @EduardoGomes-oo9vt 
 ND vê isso eles já voltaram e trouxeram de novo o competitivo pro Br porém o foco ainda vai ser a china",71,0,1 year ago
"E aí, Brasil｜Anúncio de pré-registro｜Honor of Kings",609,So por esse video ja merece todo carinho dos Brasileiros .. Que video foda,3,0,1 year ago
"E aí, Brasil｜Anúncio de pré-registro｜Honor of Kings",609,"A comunidade, a rua de paralelepipado, skate, churrasco, o futebol de rua, as escadarias, o grafite... Tudo junto e misturado de nossa cultura brasileira. Vídeo sensacional.",4,0,1 year ago
"E aí, Brasil｜Anúncio de pré-registro｜Honor of Kings",609,"Maneirinho essa anúncio, dá p ver que eles se dedicaram",31,0,1 year ago
"E aí, Brasil｜Anúncio de pré-registro｜Honor of Kings",609,"Obrigada pelo carinho ao nosso povo brasileiro!!!!Esse é o primeiro jogo que me diverti de verdade jogando,estou ansiosa pelo lançamento",3,0,1 year ago
"E aí, Brasil｜Anúncio de pré-registro｜Honor of Kings",609,"Caramba mano! Que incrível o HoK está dando atenção a comunidade brasileira. Até me chamou mais a atenção.
巴西的游戏环境利于王者荣耀的发展吧",8,1 reply,1 year ago
"E aí, Brasil｜Anúncio de pré-registro｜Honor of Kings",609,Vocês são demais obrigado Honor of Kings,6,0,1 year ago
"E aí, Brasil｜Anúncio de pré-registro｜Honor of Kings",609,So eu arrepiei no ( E ai Brasil),3,0,8 months ago
"E aí, Brasil｜Anúncio de pré-registro｜Honor of Kings",609,"Que vídeo mais lindo 
. Absolutamente encantada com toda atenção ao público BR",3,0,1 year ago
"E aí, Brasil｜Anúncio de pré-registro｜Honor of Kings",609,"Ok, vocês conseguiram chamar minha atenção, amei demaaaais (so espero ter espaço suficiente 
)",4,0,1 year ago
"E aí, Brasil｜Anúncio de pré-registro｜Honor of Kings",609,Quero ver as dublagens do herói amooo obg HOK,5,0,1 year ago
"E aí, Brasil｜Anúncio de pré-registro｜Honor of Kings",609,"Esse jogo promete tudo, meu deus que maravilhoso!
Só de ver essa atenção pra um vídeo de server br de um jogo chinês ja dá uma alegria que n tem nem como, expectativa altíssima e acho que não tem como dar errado
hok的cg质量绝对是非常高的",5,1 reply,1 year ago
"E aí, Brasil｜Anúncio de pré-registro｜Honor of Kings",609,"Gostei muito desse jogo achei ele super incrível e assim que eu baixei Já amei muito, ele é quase igual o mobile Legends mas a é diferença é que a gente pode usar vários heróis de graça e também ganhar um baú todo dia fico muito feliz em saber que o Brasil é o primeiro país além da Coreia a lançar o Honor of kings que venham muitos mais jogos que o Brasil seja lembrado",2,0,10 months ago
"E aí, Brasil｜Anúncio de pré-registro｜Honor of Kings",609,"A Atenção de vcs pra nois brasileiros é muito valiosa , linda atitude de vcs , com certeza vou migrar pra vcs e irem jogar bastante no lançamento, sucesso HOK",1,0,1 year ago
"E aí, Brasil｜Anúncio de pré-registro｜Honor of Kings",609,Amei o trailer ficou lindo,9,0,1 year ago
"E aí, Brasil｜Anúncio de pré-registro｜Honor of Kings",609,"Top demais, vlw HOK... espero vc em breve. 
️
Logo logo nos encontraremos no campo de batalha!",6,0,1 year ago
"E aí, Brasil｜Anúncio de pré-registro｜Honor of Kings",609,Sério eu tô muito feliz com certeza fico feliz por terem um carinho pelo Brasil adorei ganhei meu dia,1,0,1 year ago (edited)
"E aí, Brasil｜Anúncio de pré-registro｜Honor of Kings",609,Excellent visuals! Can't wait to play,4,0,1 year ago
"E aí, Brasil｜Anúncio de pré-registro｜Honor of Kings",609,"Estou muito feliz que vocês estão dando anteçao para o Brasil, não conhecia o jogo antes mas espero ansioso para começar a jogar e ser um dos melhores :)
这款游戏的职业比赛已经进入了亚运会",3,1 reply,1 year ago
"E aí, Brasil｜Anúncio de pré-registro｜Honor of Kings",609,Representou! Sucesso! 🇧🇷,1,0,1 year ago
"E aí, Brasil｜Anúncio de pré-registro｜Honor of Kings",609,"Ja deixei até em pré registro, tô ansioso pra jogar",1,0,1 year ago
"E aí, Brasil｜Anúncio de pré-registro｜Honor of Kings",609,MEU DUES Q LINDO!! Vem com tudo!,4,0,1 year ago
"E aí, Brasil｜Anúncio de pré-registro｜Honor of Kings",609,"Doido para jogar, ainda mais com esse vídeo, corre pra cá HOK",3,0,1 year ago
"E aí, Brasil｜Anúncio de pré-registro｜Honor of Kings",609,Anciosa pro lançamento,2,0,1 year ago
"E aí, Brasil｜Anúncio de pré-registro｜Honor of Kings",609,"Excelente! As referências ao Brasil principalmente o rio de janeiro com a skatista, escadaria Selaron, as várias referências ao subúrbio ficaram top",6,0,1 year ago
"E aí, Brasil｜Anúncio de pré-registro｜Honor of Kings",609,"Manoooo como ses consegue fazer isso tudoooo um jogo inteiro e incrível e fazer animações 
 me rrendpooo",1,0,10 months ago
"E aí, Brasil｜Anúncio de pré-registro｜Honor of Kings",609,"Muito top, vou jogar!",2,0,1 year ago
"E aí, Brasil｜Anúncio de pré-registro｜Honor of Kings",609,Q lance logo!!! amém,1,0,1 year ago
"E aí, Brasil｜Anúncio de pré-registro｜Honor of Kings",609,So pelo reconhecimento já merecem o like.,1,0,1 year ago (edited)
"E aí, Brasil｜Anúncio de pré-registro｜Honor of Kings",609,"Meu Deus até deu arrepio 
️
️
️
️ quero que lança logo!!",1,0,1 year ago
"E aí, Brasil｜Anúncio de pré-registro｜Honor of Kings",609,"Obrigado demais pela consideração de voces pelo brasil 
  agradeço demais 
 vai ser uma honra pra min jogar honor no lançamento",0,0,1 year ago
"E aí, Brasil｜Anúncio de pré-registro｜Honor of Kings",609,Tô muitoo animada pro lançamento já até deixei o pré registro tô doida pra quando pode abaixa vó joga muito,0,0,1 year ago
"E aí, Brasil｜Anúncio de pré-registro｜Honor of Kings",609,"Obrigado por avisar nós honor of kings,o jogo AGR vai estourar MT,ainda mais com esse vídeo feito pra nós",3,0,1 year ago
"E aí, Brasil｜Anúncio de pré-registro｜Honor of Kings",609,Tô pulando de alegria aqui!! Finalmente.,2,0,1 year ago
"E aí, Brasil｜Anúncio de pré-registro｜Honor of Kings",609,"Descobri o jogo por conta do anúncio do YouTube, e fiquei pasma quando escutei o ""Eai Brasil"" me deu mais vontade de jogar e mais ansiedade ainda pro lançamento do jogo. Só vem que eu tô preparada.",3,0,1 year ago
"E aí, Brasil｜Anúncio de pré-registro｜Honor of Kings",609,Quando ela falou EAI Brasil até arrepiou aqui. Vai ser muito lindo esse jogo. Joguei o período de teste e está incrível. Ótimos personagens. Ansioso estou pelo lançamento do servidor BR,2,0,1 year ago
"E aí, Brasil｜Anúncio de pré-registro｜Honor of Kings",609,"Ansioso demais 
🇧🇷",1,0,1 year ago
"E aí, Brasil｜Anúncio de pré-registro｜Honor of Kings",609,Obrigada hok amo vcs,1,0,1 year ago
"E aí, Brasil｜Anúncio de pré-registro｜Honor of Kings",609,"Caraca, o carinho que eles estão dando pro Brasil fez meu coração ficar quentinho, tô ansioso pro jogo ficar disponível pra baixar logo, participei da beta e adorei o MOBA.",1,0,1 year ago
"E aí, Brasil｜Anúncio de pré-registro｜Honor of Kings",609,"CARAMBA,Que vídeo Lindo,Eu até Arrepiei aqui,Amei o Carinho de vcs ao fazer um vídeo para nossa Comunidade, Vocês são Tops",0,0,1 year ago
"E aí, Brasil｜Anúncio de pré-registro｜Honor of Kings",609,Sucesso tô muito ansioso,1,0,1 year ago
"E aí, Brasil｜Anúncio de pré-registro｜Honor of Kings",609,"Joguei na fase beta, e gostei pra caramba. Tô ansioso pelo lançamento",2,0,1 year ago
"E aí, Brasil｜Anúncio de pré-registro｜Honor of Kings",609,Só estou no aguardo slc que top,1,0,1 year ago
"E aí, Brasil｜Anúncio de pré-registro｜Honor of Kings",609,Aguardo ansiosamente para o lançamento desse jogo,1,0,1 year ago
"E aí, Brasil｜Anúncio de pré-registro｜Honor of Kings",609,"Joguei o beta do game e me diverti muito, continuem assim!! Já fiz até o pré registro na Play Store. Gostei muito que o Honor of kings foi muito atencioso em cada detalhe para a nossa cultura brasileira. Estou ansioso para jogar quando lançar!!",1,0,1 year ago
"E aí, Brasil｜Anúncio de pré-registro｜Honor of Kings",609,"Um jogo que se importa com o Brasil me deixa muito feliz, Honor Of Kings vai ser com certeza o meu jogo mais jogado desse ano!! Só vem!!!",0,0,1 year ago
"E aí, Brasil｜Anúncio de pré-registro｜Honor of Kings",609,Brabo!! Ansioso pelo lançamento,1,0,1 year ago
"E aí, Brasil｜Anúncio de pré-registro｜Honor of Kings",609,maravilhoso! só vem,0,0,1 year ago
"E aí, Brasil｜Anúncio de pré-registro｜Honor of Kings",609,Estou no aguardo demais,0,0,1 year ago
"E aí, Brasil｜Anúncio de pré-registro｜Honor of Kings",609,"Estou ansioso pelo lançamento, POR FAVOR LANCEM LOGO",1,0,1 year ago
"E aí, Brasil｜Anúncio de pré-registro｜Honor of Kings",609,"Só pela atenção ao nosso mercado vou fazer o pré registro,  Sensacional  essa atitude. tem meu apoio.",0,0,1 year ago
"E aí, Brasil｜Anúncio de pré-registro｜Honor of Kings",609,Me ganhou só por demonstrar interesse na comunidade brasileira. Estou esperando ansiosamente o lançamento!!!!,1,0,1 year ago
"E aí, Brasil｜Anúncio de pré-registro｜Honor of Kings",609,"Ameii 🇧🇷
Uma crande homenagem ao BR
Grande",3,2 replies,1 year ago
"E aí, Brasil｜Anúncio de pré-registro｜Honor of Kings",609,Um vídeo exclusivo pros brs <3,1,0,1 year ago
"E aí, Brasil｜Anúncio de pré-registro｜Honor of Kings",609,"QUE ATENÇÃO LINDA DO HONOR OF KINGS!!! Linda as artes e produção, ansiosa para o lançamento.",0,0,1 year ago
"E aí, Brasil｜Anúncio de pré-registro｜Honor of Kings",609,"Ficou top na moral, para min e o melhor moba de todos os tempos",2,0,1 year ago
"E aí, Brasil｜Anúncio de pré-registro｜Honor of Kings",609,"Que perfeição! Eu me emocionei muito meu deuses
Estou ansiosa demais para o jogo! Que venha logo!! Adoro demais",0,0,1 year ago
"E aí, Brasil｜Anúncio de pré-registro｜Honor of Kings",609,Cara tô ansioso por honor voltar  gogogogogo,1,0,1 year ago
"E aí, Brasil｜Anúncio de pré-registro｜Honor of Kings",609,"Já fiz meu pré registro, só falta o dia de lançamento, vou jogar muito.",1,0,1 year ago
"E aí, Brasil｜Anúncio de pré-registro｜Honor of Kings",609,Lindo demais,2,0,1 year ago
"E aí, Brasil｜Anúncio de pré-registro｜Honor of Kings",609,"Adorei o jogo quando ele ainda tava em testes e adorei que vcs ainda deram a moeda do jogo pra gente pegar skins na maior humildade,mesmo que as skins saião da conta e comece do zero eu vou jogar no maior hype",1,0,1 year ago
